{
  "id": "2021725800886632924",
  "url": "https://x.com/alexdolbun/status/2021725800886632924",
  "author": "alexdolbun",
  "created_at": "2026-02-11T23:19:27.000Z",
  "text": "Q1 2026 parked till 2036 $UM radar Australia Sydney GIS mapping",
  "media": ["https://pbs.twimg.com/media/HA6c5AiXgAAo30D.jpg"],
  "status": "queued",
  "persons_extracted": []
}